{
  "name": "isoline-scene",
  "version": "1.0.0",
  "category": "3d-hero",
  "tags": [
    "svg",
    "isometric",
    "line-art",
    "illustration",
    "interactive",
    "cursor",
    "dark",
    "hero",
    "orange"
  ],
  "summary": "Split hero with Isoline's animated isometric scene beside the copy: a mechanical keyboard drawn in SVG hairlines that types by itself while keys dip under the pointer, on a grid floor that fades into the page. Thirteen other scenes (a city with traffic, a cargo port, a drone delivery, an exploded phone, your word as a dollhouse) are one option away. Plain SVG, no WebGL, no dependency; upstream pauses it off screen and holds a readable pose under reduced motion. With no script the frame rests on a faint isometric grid under an orange glow.",
  "needs": [],
  "options": {
    "scene": {
      "type": "string",
      "default": "keyboard",
      "description": "city, supply, flight, delivery, port, line, product, steamer, cabinet, lockers, keyboard, interface, relief or word. examples/basic.html's choice."
    },
    "azimuth": {
      "type": "number",
      "default": 30,
      "min": -90,
      "max": 90,
      "step": 1,
      "description": "Camera turn in degrees. Upstream range; default from examples/basic.html."
    },
    "elevation": {
      "type": "number",
      "default": 36,
      "min": 12,
      "max": 70,
      "step": 1,
      "description": "Camera tilt in degrees. Upstream range; default from examples/basic.html."
    },
    "accent": {
      "type": "string",
      "default": "#ff6a3d",
      "description": "What moves or answers the pointer. examples/basic.html's colour."
    },
    "plate": {
      "type": "string",
      "default": "#08090a",
      "description": "Ground colour, the stage background. Upstream default."
    },
    "hi": {
      "type": "string",
      "default": "#d0d6e0",
      "description": "Lit lines. Upstream default."
    },
    "floor": {
      "type": "string",
      "default": "grid",
      "description": "Floor under the scene: none, grid or dots. examples/basic.html's choice."
    },
    "floorStrength": {
      "type": "number",
      "default": 0.5,
      "min": 0,
      "max": 1,
      "step": 0.05,
      "description": "0 faint to 1 strong. Default from examples/basic.html."
    },
    "density": {
      "type": "number",
      "default": 0.5,
      "min": 0,
      "max": 1,
      "step": 0.05,
      "description": "0 to 1, read by each scene its own way: traffic, typing speed, yard stacks. Upstream default."
    },
    "speed": {
      "type": "number",
      "default": 1,
      "min": 0,
      "max": 4,
      "step": 0.05,
      "description": "Animation speed. Upstream default."
    },
    "stroke": {
      "type": "number",
      "default": 0.9,
      "min": 0.3,
      "max": 3,
      "step": 0.05,
      "description": "Line width in px. Upstream default."
    },
    "spin": {
      "type": "boolean",
      "default": false,
      "description": "Turntable: the camera circles the scene. Upstream default."
    },
    "parallax": {
      "type": "boolean",
      "default": true,
      "description": "The camera leans a little towards the pointer. Upstream default."
    },
    "interactive": {
      "type": "boolean",
      "default": true,
      "description": "The scene answers the pointer. Upstream default."
    },
    "labels": {
      "type": "boolean",
      "default": true,
      "description": "Labels and callouts. Upstream default."
    }
  },
  "license": "MIT",
  "origin": {
    "repo": "JuPicker/isoline",
    "commit": "77c1da5798138cb2ae82842b7734867beba95828",
    "path": [
      "isoline.min.js",
      "examples/basic.html"
    ]
  },
  "deviations": [
    {
      "what": "The README points script-tag users at the committed isoline.min.js, so that build is ported verbatim inside a named function isolineLib(t), which mount() calls once with window. Removed: the `!function(t){` IIFE head, the call that passed it window, and the `module.exports=or` and `t.Isoline=or` assignments at the end; the body returns the constructor `or` instead.",
      "why": "Seam. A paw-fx module touches no global at import time, and the bundle published itself onto window the moment it loaded.",
      "kind": "seam"
    },
    {
      "what": "mount(el, opts) appends a stage div to the section's frame and calls new Isoline(stage, opts) with examples/basic.html's settings (keyboard scene, azimuth 30, elevation 36, accent #ff6a3d, grid floor at strength 0.5) as defaults. update(next) is upstream's set(next). destroy() is upstream's destroy() plus removing the stage and data-fx-live. Reduced motion, the off-screen pause and every pointer response are upstream's.",
      "why": "Seam. Upstream writes role, aria-label, its --il-* palette and a background onto the element it is given; a stage this module owns keeps all of that off the section.",
      "kind": "seam"
    },
    {
      "what": "The section is a split hero, copy beside a 16:10 frame that stacks under 760px. The resting frame is a faint isometric grid (lines at the two iso angles in upstream's mid tone #3e3e44 on its plate #08090a) under a soft glow in the accent, faded at its edges; upstream's own toSVG() frame was not baked in because, added to the 47 KB gzipped bundle, it crossed the 60 KB own-code cap.",
      "why": "Ours. A dark empty frame reads as broken before the script runs, and the copy is kept off the line work so it never sits on hairlines.",
      "kind": "ours"
    }
  ]
}